{
  "slug": "ocean-glass",
  "name": "海面玻璃",
  "summary": "清透海岸色调叠加磨砂玻璃面板，明亮但不刺眼。",
  "author": {
    "name": "Tidal Workshop",
    "handle": "tidalworkshop",
    "curated": false
  },
  "category": "nature",
  "platforms": [
    "macos",
    "windows"
  ],
  "colors": [
    "teal",
    "blue",
    "neutral"
  ],
  "tags": [
    "海洋",
    "玻璃",
    "青蓝",
    "明亮"
  ],
  "stats": {
    "downloads": 11390,
    "rating": 4.8,
    "reviews": 284
  },
  "featured": true,
  "isNew": false,
  "version": "1.2.1",
  "engineRange": ">=1.1.0 <2.0.0",
  "publishedAt": "2026-05-06T08:00:00.000Z",
  "license": {
    "name": "CC0 1.0 Universal",
    "spdx": "CC0-1.0",
    "source": "original-procedural-artwork"
  },
  "previewStyle": {
    "backgroundColor": "#9ed7dc",
    "backgroundImage": "linear-gradient(175deg, rgba(235, 249, 246, .9) 0 30%, rgba(91, 187, 197, .58) 31% 55%, rgba(21, 92, 121, .82) 80% 100%), radial-gradient(circle at 75% 28%, rgba(255, 255, 255, .7), transparent 18%)",
    "panelColor": "rgba(237, 251, 250, .68)",
    "panelBorder": "rgba(255, 255, 255, .46)",
    "textColor": "#163b45",
    "mutedTextColor": "#47727a",
    "accentColor": "#087f8c",
    "accentSoft": "rgba(8, 127, 140, .12)",
    "codeColor": "#075f72",
    "shadow": "0 28px 70px rgba(19, 80, 94, .22)",
    "pattern": "horizon"
  },
  "package": null
}
